leelaz_opencl_tuning
0;XgemmBatched;128;100;128;16; -DKWG=32 -DKWI=2 -DMDIMA=16 -DMDIMC=16 -DMWG=64 -DNDIMB=8 -DNDIMC=8 -DNWG=64 -DSA=1 -DSB=1 -DSTRM=0 -DSTRN=0 -DVWM=4 -DVWN=4;OpenCL: Intel Inc. Intel(R) Iris(TM) Graphics 6100 @ 1100MHz
